cbsa_fips,cbsa,emp_2005,emp_2015
998,United States (Metropolitan Portion),149308196,166854897
10180,"Abilene, TX (Metropolitan Statistical Area)",92937,102565
10420,"Akron, OH (Metropolitan Statistical Area)",412097,425964
10500,"Albany, GA (Metropolitan Statistical Area)",80177,81396
10540,"Albany-Lebanon, OR (Metropolitan Statistical Area)",57088,58931
10580,"Albany-Schenectady-Troy, NY (Metropolitan Statistical Area)",530740,556334
10740,"Albuquerque, NM (Metropolitan Statistical Area)",476212,489286
10780,"Alexandria, LA (Metropolitan Statistical Area)",79635,81880
10900,"Allentown-Bethlehem-Easton, PA-NJ (Metropolitan Statistical Area)",418886,459141
11020,"Altoona, PA (Metropolitan Statistical Area)",75271,75560
11100,"Amarillo, TX (Metropolitan Statistical Area)",144955,162740
11180,"Ames, IA (Metropolitan Statistical Area)",71916,77356
11260,"Anchorage, AK (Metropolitan Statistical Area)",220731,245176
11460,"Ann Arbor, MI (Metropolitan Statistical Area)",247846,258276
11500,"Anniston-Oxford, AL (Metropolitan Statistical Area)",63108,58053
11540,"Appleton, WI (Metropolitan Statistical Area)",143877,151895
11700,"Asheville, NC (Metropolitan Statistical Area)",229213,259992
12020,"Athens-Clarke County, GA (Metropolitan Statistical Area)",103703,117351
12060,"Atlanta-Sandy Springs-Alpharetta, GA (Metropolitan Statistical Area)",3014860,3540455
12100,"Atlantic City-Hammonton, NJ (Metropolitan Statistical Area)",183113,164848
12220,"Auburn-Opelika, AL (Metropolitan Statistical Area)",63934,78203
12260,"Augusta-Richmond County, GA-SC (Metropolitan Statistical Area)",282917,307239
12420,"Austin-Round Rock-Georgetown, TX (Metropolitan Statistical Area)",934981,1324618
12540,"Bakersfield, CA (Metropolitan Statistical Area)",341791,404894
12580,"Baltimore-Columbia-Towson, MD (Metropolitan Statistical Area)",1623895,1788464
12620,"Bangor, ME (Metropolitan Statistical Area)",92341,90466
12700,"Barnstable Town, MA (Metropolitan Statistical Area)",139159,150122
12940,"Baton Rouge, LA (Metropolitan Statistical Area)",447001,523290
12980,"Battle Creek, MI (Metropolitan Statistical Area)",75646,71316
13020,"Bay City, MI (Metropolitan Statistical Area)",50662,47382
13140,"Beaumont-Port Arthur, TX (Metropolitan Statistical Area)",195198,212976
13220,"Beckley, WV (Metropolitan Statistical Area)",56027,55257
13380,"Bellingham, WA (Metropolitan Statistical Area)",107985,119693
13460,"Bend, OR (Metropolitan Statistical Area)",92848,109460
13740,"Billings, MT (Metropolitan Statistical Area)",106966,119065
13780,"Binghamton, NY (Metropolitan Statistical Area)",135172,128332
13820,"Birmingham-Hoover, AL (Metropolitan Statistical Area)",613937,639453
13900,"Bismarck, ND (Metropolitan Statistical Area)",73520,95097
13980,"Blacksburg-Christiansburg, VA (Metropolitan Statistical Area) *",84239,87456
14010,"Bloomington, IL (Metropolitan Statistical Area)",109996,112398
14020,"Bloomington, IN (Metropolitan Statistical Area)",90907,94447
14100,"Bloomsburg-Berwick, PA (Metropolitan Statistical Area)",49459,52723
14260,"Boise City, ID (Metropolitan Statistical Area)",346498,395839
14460,"Boston-Cambridge-Newton, MA-NH (Metropolitan Statistical Area)",3013744,3490789
14500,"Boulder, CO (Metropolitan Statistical Area) *",218044,258598
14540,"Bowling Green, KY (Metropolitan Statistical Area)",84829,96190
14740,"Bremerton-Silverdale-Port Orchard, WA (Metropolitan Statistical Area)",124980,127305
14860,"Bridgeport-Stamford-Norwalk, CT (Metropolitan Statistical Area)",591253,657163
15180,"Brownsville-Harlingen, TX (Metropolitan Statistical Area)",156329,188695
15260,"Brunswick, GA (Metropolitan Statistical Area)",56363,57149
15380,"Buffalo-Cheektowaga, NY (Metropolitan Statistical Area)",636763,663455
15500,"Burlington, NC (Metropolitan Statistical Area)",76703,79311
15540,"Burlington-South Burlington, VT (Metropolitan Statistical Area)",147964,162259
15680,"California-Lexington Park, MD (Metropolitan Statistical Area)",53234,60296
15940,"Canton-Massillon, OH (Metropolitan Statistical Area)",220170,219220
15980,"Cape Coral-Fort Myers, FL (Metropolitan Statistical Area)",300554,353158
16020,"Cape Girardeau, MO-IL (Metropolitan Statistical Area)",59727,60244
16060,"Carbondale-Marion, IL (Metropolitan Statistical Area)",75320,76461
16180,"Carson City, NV (Metropolitan Statistical Area)",43878,37650
16220,"Casper, WY (Metropolitan Statistical Area)",48826,57161
16300,"Cedar Rapids, IA (Metropolitan Statistical Area)",164717,181094
16540,"Chambersburg-Waynesboro, PA (Metropolitan Statistical Area)",72375,78821
16580,"Champaign-Urbana, IL (Metropolitan Statistical Area)",129866,133560
16620,"Charleston, WV (Metropolitan Statistical Area)",161220,154402
16700,"Charleston-North Charleston, SC (Metropolitan Statistical Area)",364423,448908
16740,"Charlotte-Concord-Gastonia, NC-SC (Metropolitan Statistical Area)",1209673,1491118
16820,"Charlottesville, VA (Metropolitan Statistical Area) *",126006,145761
16860,"Chattanooga, TN-GA (Metropolitan Statistical Area)",302725,310769
16940,"Cheyenne, WY (Metropolitan Statistical Area)",57722,67095
16980,"Chicago-Naperville-Elgin, IL-IN-WI (Metropolitan Statistical Area)",5528261,5964154
17020,"Chico, CA (Metropolitan Statistical Area)",103948,110049
17140,"Cincinnati, OH-KY-IN (Metropolitan Statistical Area)",1266491,1322949
17300,"Clarksville, TN-KY (Metropolitan Statistical Area)",138270,151139
17420,"Cleveland, TN (Metropolitan Statistical Area)",55733,61965
17460,"Cleveland-Elyria, OH (Metropolitan Statistical Area)",1299430,1313275
17660,"Coeur d'Alene, ID (Metropolitan Statistical Area)",73502,82666
17780,"College Station-Bryan, TX (Metropolitan Statistical Area)",115746,146044
17820,"Colorado Springs, CO (Metropolitan Statistical Area)",365026,404672
17860,"Columbia, MO (Metropolitan Statistical Area)",122431,138281
17900,"Columbia, SC (Metropolitan Statistical Area)",433120,489418
17980,"Columbus, GA-AL (Metropolitan Statistical Area)",168743,182245
18020,"Columbus, IN (Metropolitan Statistical Area)",51636,60078
18140,"Columbus, OH (Metropolitan Statistical Area)",1166767,1315582
18580,"Corpus Christi, TX (Metropolitan Statistical Area)",217363,248914
18700,"Corvallis, OR (Metropolitan Statistical Area)",48107,50420
18880,"Crestview-Fort Walton Beach-Destin, FL (Metropolitan Statistical Area)",150544,163175
19060,"Cumberland, MD-WV (Metropolitan Statistical Area)",48486,48347
19100,"Dallas-Fort Worth-Arlington, TX (Metropolitan Statistical Area)",3621905,4633996
19140,"Dalton, GA (Metropolitan Statistical Area)",89189,81978
19180,"Danville, IL (Metropolitan Statistical Area)",40190,37741
19300,"Daphne-Fairhope-Foley, AL (Metropolitan Statistical Area)",82612,103915
19340,"Davenport-Moline-Rock Island, IA-IL (Metropolitan Statistical Area)",231269,229890
19430,"Dayton-Kettering, OH (Metropolitan Statistical Area)",482766,469853
19460,"Decatur, AL (Metropolitan Statistical Area)",74947,72980
19500,"Decatur, IL (Metropolitan Statistical Area)",65139,63036
19660,"Deltona-Daytona Beach-Ormond Beach, FL (Metropolitan Statistical Area)",253529,269022
19740,"Denver-Aurora-Lakewood, CO (Metropolitan Statistical Area) *",1571107,1917197
19780,"Des Moines-West Des Moines, IA (Metropolitan Statistical Area)",399647,458947
19820,"Detroit-Warren-Dearborn, MI (Metropolitan Statistical Area)",2503800,2508262
20020,"Dothan, AL (Metropolitan Statistical Area)",78855,77940
20100,"Dover, DE (Metropolitan Statistical Area)",81729,88475
20220,"Dubuque, IA (Metropolitan Statistical Area)",65285,73546
20260,"Duluth, MN-WI (Metropolitan Statistical Area)",165001,169206
20500,"Durham-Chapel Hill, NC (Metropolitan Statistical Area)",349831,407825
20700,"East Stroudsburg, PA (Metropolitan Statistical Area)",74896,75421
20740,"Eau Claire, WI (Metropolitan Statistical Area)",100615,108513
20940,"El Centro, CA (Metropolitan Statistical Area)",67019,81453
21060,"Elizabethtown-Fort Knox, KY (Metropolitan Statistical Area)",73784,76543
21140,"Elkhart-Goshen, IN (Metropolitan Statistical Area)",150926,151715
21300,"Elmira, NY (Metropolitan Statistical Area)",46498,45090
21340,"El Paso, TX (Metropolitan Statistical Area)",351148,424004
21420,"Enid, OK (Metropolitan Statistical Area)",34825,39849
21500,"Erie, PA (Metropolitan Statistical Area)",161240,161250
21660,"Eugene-Springfield, OR (Metropolitan Statistical Area)",196415,201062
21780,"Evansville, IN-KY (Metropolitan Statistical Area)",188590,191203
21820,"Fairbanks, AK (Metropolitan Statistical Area) *",55121,58117
22020,"Fargo, ND-MN (Metropolitan Statistical Area)",139308,174341
22140,"Farmington, NM (Metropolitan Statistical Area)",62057,65114
22180,"Fayetteville, NC (Metropolitan Statistical Area)",234800,249085
22220,"Fayetteville-Springdale-Rogers, AR (Metropolitan Statistical Area)",244037,292604
22380,"Flagstaff, AZ (Metropolitan Statistical Area)",74562,83483
22420,"Flint, MI (Metropolitan Statistical Area)",199141,187279
22500,"Florence, SC (Metropolitan Statistical Area)",105676,110761
22520,"Florence-Muscle Shoals, AL (Metropolitan Statistical Area)",71142,75135
22540,"Fond du Lac, WI (Metropolitan Statistical Area)",58968,60043
22660,"Fort Collins, CO (Metropolitan Statistical Area)",180859,217242
22900,"Fort Smith, AR-OK (Metropolitan Statistical Area)",137292,133229
23060,"Fort Wayne, IN (Metropolitan Statistical Area)",242116,252479
23420,"Fresno, CA (Metropolitan Statistical Area)",424613,475821
23460,"Gadsden, AL (Metropolitan Statistical Area)",50115,49731
23540,"Gainesville, FL (Metropolitan Statistical Area)",176134,184286
23580,"Gainesville, GA (Metropolitan Statistical Area)",89023,107204
23900,"Gettysburg, PA (Metropolitan Statistical Area)",46439,47590
24020,"Glens Falls, NY (Metropolitan Statistical Area)",69447,71741
24140,"Goldsboro, NC (Metropolitan Statistical Area)",58868,58951
24220,"Grand Forks, ND-MN (Metropolitan Statistical Area)",69046,72770
24260,"Grand Island, NE (Metropolitan Statistical Area)",46165,51136
24300,"Grand Junction, CO (Metropolitan Statistical Area)",79069,86518
24340,"Grand Rapids-Kentwood, MI (Metropolitan Statistical Area)",622729,681446
24420,"Grants Pass, OR (Metropolitan Statistical Area)",37991,37093
24500,"Great Falls, MT (Metropolitan Statistical Area)",48759,50301
24540,"Greeley, CO (Metropolitan Statistical Area) *",116668,150079
24580,"Green Bay, WI (Metropolitan Statistical Area)",205762,213859
24660,"Greensboro-High Point, NC (Metropolitan Statistical Area)",445612,466094
24780,"Greenville, NC (Metropolitan Statistical Area)",86281,98448
24860,"Greenville-Anderson, SC (Metropolitan Statistical Area)",446423,507323
25060,"Gulfport-Biloxi, MS (Metropolitan Statistical Area)",205255,214586
25180,"Hagerstown-Martinsburg, MD-WV (Metropolitan Statistical Area)",127898,136184
25220,"Hammond, LA (Metropolitan Statistical Area)",52420,60761
25260,"Hanford-Corcoran, CA (Metropolitan Statistical Area)",57079,60540
25420,"Harrisburg-Carlisle, PA (Metropolitan Statistical Area)",386116,409384
25500,"Harrisonburg, VA (Metropolitan Statistical Area) *",74983,82068
25540,"Hartford-East Hartford-Middletown, CT (Metropolitan Statistical Area)",775261,813676
25620,"Hattiesburg, MS (Metropolitan Statistical Area)",80555,93175
25860,"Hickory-Lenoir-Morganton, NC (Metropolitan Statistical Area)",203025,191485
25940,"Hilton Head Island-Bluffton, SC (Metropolitan Statistical Area)",105260,115583
25980,"Hinesville, GA (Metropolitan Statistical Area)",37293,41520
26140,"Homosassa Springs, FL (Metropolitan Statistical Area)",47674,47827
26300,"Hot Springs, AR (Metropolitan Statistical Area)",51052,52084
26380,"Houma-Thibodaux, LA (Metropolitan Statistical Area)",108049,124444
26420,"Houston-The Woodlands-Sugar Land, TX (Metropolitan Statistical Area)",3078388,4049493
26580,"Huntington-Ashland, WV-KY-OH (Metropolitan Statistical Area)",174516,173590
26620,"Huntsville, AL (Metropolitan Statistical Area)",244689,280587
26820,"Idaho Falls, ID (Metropolitan Statistical Area)",76232,85547
26900,"Indianapolis-Carmel-Anderson, IN (Metropolitan Statistical Area)",1133886,1269181
26980,"Iowa City, IA (Metropolitan Statistical Area)",109151,126647
27060,"Ithaca, NY (Metropolitan Statistical Area)",68246,69670
27100,"Jackson, MI (Metropolitan Statistical Area)",77179,74820
27140,"Jackson, MS (Metropolitan Statistical Area)",340095,378455
27180,"Jackson, TN (Metropolitan Statistical Area)",100977,103819
27260,"Jacksonville, FL (Metropolitan Statistical Area)",752286,839177
27340,"Jacksonville, NC (Metropolitan Statistical Area)",99289,110286
27500,"Janesville-Beloit, WI (Metropolitan Statistical Area)",85936,83315
27620,"Jefferson City, MO (Metropolitan Statistical Area)",99222,98864
27740,"Johnson City, TN (Metropolitan Statistical Area)",102263,103394
27780,"Johnstown, PA (Metropolitan Statistical Area)",72655,69164
27860,"Jonesboro, AR (Metropolitan Statistical Area)",63514,72461
27900,"Joplin, MO (Metropolitan Statistical Area)",99546,101560
27980,"Kahului-Wailuku-Lahaina, HI (Metropolitan Statistical Area)",96095,104675
28020,"Kalamazoo-Portage, MI (Metropolitan Statistical Area)",148848,150341
28100,"Kankakee, IL (Metropolitan Statistical Area)",53554,55569
28140,"Kansas City, MO-KS (Metropolitan Statistical Area)",1233735,1342743
28420,"Kennewick-Richland, WA (Metropolitan Statistical Area)",116263,145211
28660,"Killeen-Temple, TX (Metropolitan Statistical Area)",194934,224730
28700,"Kingsport-Bristol, TN-VA (Metropolitan Statistical Area) *",159083,156781
28740,"Kingston, NY (Metropolitan Statistical Area)",87641,89271
28940,"Knoxville, TN (Metropolitan Statistical Area)",460971,491034
29020,"Kokomo, IN (Metropolitan Statistical Area)",51636,48604
29100,"La Crosse-Onalaska, WI-MN (Metropolitan Statistical Area)",89432,95841
29180,"Lafayette, LA (Metropolitan Statistical Area)",252865,295271
29200,"Lafayette-West Lafayette, IN (Metropolitan Statistical Area)",111853,123172
29340,"Lake Charles, LA (Metropolitan Statistical Area)",108680,129027
29420,"Lake Havasu City-Kingman, AZ (Metropolitan Statistical Area)",72539,66867
29460,"Lakeland-Winter Haven, FL (Metropolitan Statistical Area)",266193,281025
29540,"Lancaster, PA (Metropolitan Statistical Area)",300350,323836
29620,"Lansing-East Lansing, MI (Metropolitan Statistical Area)",299192,293707
29700,"Laredo, TX (Metropolitan Statistical Area)",108658,139297
29740,"Las Cruces, NM (Metropolitan Statistical Area)",89628,99881
29820,"Las Vegas-Henderson-Paradise, NV (Metropolitan Statistical Area)",1087078,1215757
29940,"Lawrence, KS (Metropolitan Statistical Area)",67579,70423
30020,"Lawton, OK (Metropolitan Statistical Area)",64462,68975
30140,"Lebanon, PA (Metropolitan Statistical Area)",62302,66936
30300,"Lewiston, ID-WA (Metropolitan Statistical Area)",33984,35273
30340,"Lewiston-Auburn, ME (Metropolitan Statistical Area)",60554,61709
30460,"Lexington-Fayette, KY (Metropolitan Statistical Area)",307901,345854
30620,"Lima, OH (Metropolitan Statistical Area)",68553,63555
30700,"Lincoln, NE (Metropolitan Statistical Area)",206855,226736
30780,"Little Rock-North Little Rock-Conway, AR (Metropolitan Statistical Area)",412763,448615
30860,"Logan, UT-ID (Metropolitan Statistical Area)",65734,79637
30980,"Longview, TX (Metropolitan Statistical Area)",149152,174255
31020,"Longview, WA (Metropolitan Statistical Area)",47467,48554
31080,"Los Angeles-Long Beach-Anaheim, CA (Metropolitan Statistical Area)",7475717,8402650
31140,"Louisville/Jefferson County, KY-IN (Metropolitan Statistical Area)",715555,788012
31180,"Lubbock, TX (Metropolitan Statistical Area)",161147,188264
31340,"Lynchburg, VA (Metropolitan Statistical Area) *",129811,135034
31420,"Macon-Bibb County, GA (Metropolitan Statistical Area)",127960,134823
31460,"Madera, CA (Metropolitan Statistical Area)",57801,61459
31540,"Madison, WI (Metropolitan Statistical Area)",442110,488721
31700,"Manchester-Nashua, NH (Metropolitan Statistical Area)",255100,264855
31740,"Manhattan, KS (Metropolitan Statistical Area)",73636,89196
31860,"Mankato, MN (Metropolitan Statistical Area)",65189,70058
31900,"Mansfield, OH (Metropolitan Statistical Area)",72383,65082
32580,"McAllen-Edinburg-Mission, TX (Metropolitan Statistical Area)",270969,362052
32780,"Medford, OR (Metropolitan Statistical Area)",115395,117852
32820,"Memphis, TN-MS-AR (Metropolitan Statistical Area)",777265,826563
32900,"Merced, CA (Metropolitan Statistical Area)",87573,99985
33100,"Miami-Fort Lauderdale-Pompano Beach, FL (Metropolitan Statistical Area)",3153331,3752532
33140,"Michigan City-La Porte, IN (Metropolitan Statistical Area)",57591,53291
33220,"Midland, MI (Metropolitan Statistical Area)",44863,47781
33260,"Midland, TX (Metropolitan Statistical Area)",86823,142633
33340,"Milwaukee-Waukesha, WI (Metropolitan Statistical Area)",1008163,1037475
33460,"Minneapolis-St. Paul-Bloomington, MN-WI (Metropolitan Statistical Area)",2236087,2424810
33540,"Missoula, MT (Metropolitan Statistical Area)",73462,80142
33660,"Mobile, AL (Metropolitan Statistical Area)",225206,239780
33700,"Modesto, CA (Metropolitan Statistical Area)",224867,237579
33740,"Monroe, LA (Metropolitan Statistical Area)",110477,116732
33780,"Monroe, MI (Metropolitan Statistical Area)",59054,57931
33860,"Montgomery, AL (Metropolitan Statistical Area)",222859,222744
34060,"Morgantown, WV (Metropolitan Statistical Area)",69278,84253
34100,"Morristown, TN (Metropolitan Statistical Area)",65691,64120
34580,"Mount Vernon-Anacortes, WA (Metropolitan Statistical Area)",63202,66727
34620,"Muncie, IN (Metropolitan Statistical Area)",62542,59592
34740,"Muskegon, MI (Metropolitan Statistical Area)",82256,80428
34820,"Myrtle Beach-Conway-North Myrtle Beach, SC-NC (Metropolitan Statistical Area)",189671,216859
34900,"Napa, CA (Metropolitan Statistical Area)",87728,103102
34940,"Naples-Marco Island, FL (Metropolitan Statistical Area)",182757,210254
34980,"Nashville-Davidson--Murfreesboro--Franklin, TN (Metropolitan Statistical Area)",1017222,1222235
35100,"New Bern, NC (Metropolitan Statistical Area)",68387,67452
35300,"New Haven-Milford, CT (Metropolitan Statistical Area)",485556,500960
35380,"New Orleans-Metairie, LA (Metropolitan Statistical Area)",699855,791230
35620,"New York-Newark-Jersey City, NY-NJ-PA (Metropolitan Statistical Area)",10533708,12210471
35660,"Niles, MI (Metropolitan Statistical Area)",84908,83430
35840,"North Port-Sarasota-Bradenton, FL (Metropolitan Statistical Area)",387813,411427
35980,"Norwich-New London, CT (Metropolitan Statistical Area)",172255,164673
36100,"Ocala, FL (Metropolitan Statistical Area)",134595,141978
36140,"Ocean City, NJ (Metropolitan Statistical Area)",60454,60318
36220,"Odessa, TX (Metropolitan Statistical Area)",67933,97014
36260,"Ogden-Clearfield, UT (Metropolitan Statistical Area)",283624,335562
36420,"Oklahoma City, OK (Metropolitan Statistical Area)",733082,857548
36500,"Olympia-Lacey-Tumwater, WA (Metropolitan Statistical Area)",124210,140179
36540,"Omaha-Council Bluffs, NE-IA (Metropolitan Statistical Area)",552642,616019
36740,"Orlando-Kissimmee-Sanford, FL (Metropolitan Statistical Area)",1250750,1504927
36780,"Oshkosh-Neenah, WI (Metropolitan Statistical Area)",108304,113074
36980,"Owensboro, KY (Metropolitan Statistical Area)",62984,67062
37100,"Oxnard-Thousand Oaks-Ventura, CA (Metropolitan Statistical Area)",435416,460788
37340,"Palm Bay-Melbourne-Titusville, FL (Metropolitan Statistical Area)",272273,272840
37460,"Panama City, FL (Metropolitan Statistical Area)",97038,105210
37620,"Parkersburg-Vienna, WV (Metropolitan Statistical Area)",52249,49783
37860,"Pensacola-Ferry Pass-Brent, FL (Metropolitan Statistical Area)",223707,233473
37900,"Peoria, IL (Metropolitan Statistical Area)",229721,230856
37980,"Philadelphia-Camden-Wilmington, PA-NJ-DE-MD (Metropolitan Statistical Area)",3384631,3646493
38060,"Phoenix-Mesa-Chandler, AZ (Metropolitan Statistical Area)",2245171,2529932
38220,"Pine Bluff, AR (Metropolitan Statistical Area)",49426,43840
38300,"Pittsburgh, PA (Metropolitan Statistical Area)",1378023,1458976
38340,"Pittsfield, MA (Metropolitan Statistical Area)",81565,86264
38540,"Pocatello, ID (Metropolitan Statistical Area)",50751,50670
38860,"Portland-South Portland, ME (Metropolitan Statistical Area)",343183,362279
38900,"Portland-Vancouver-Hillsboro, OR-WA (Metropolitan Statistical Area)",1289785,1481612
38940,"Port St. Lucie, FL (Metropolitan Statistical Area)",179580,202471
39100,"Poughkeepsie-Newburgh-Middletown, NY (Metropolitan Statistical Area)",325155,342409
39150,"Prescott Valley-Prescott, AZ (Metropolitan Statistical Area)",90797,94903
39300,"Providence-Warwick, RI-MA (Metropolitan Statistical Area)",883474,919761
39340,"Provo-Orem, UT (Metropolitan Statistical Area)",236232,317162
39380,"Pueblo, CO (Metropolitan Statistical Area)",71955,77394
39460,"Punta Gorda, FL (Metropolitan Statistical Area)",59929,68115
39540,"Racine, WI (Metropolitan Statistical Area)",97069,95297
39580,"Raleigh-Cary, NC (Metropolitan Statistical Area)",605919,792661
39660,"Rapid City, SD (Metropolitan Statistical Area)",81783,89713
39740,"Reading, PA (Metropolitan Statistical Area)",210061,222722
39820,"Redding, CA (Metropolitan Statistical Area)",91346,89870
39900,"Reno, NV (Metropolitan Statistical Area)",269843,278360
40060,"Richmond, VA (Metropolitan Statistical Area) *",730868,814616
40140,"Riverside-San Bernardino-Ontario, CA (Metropolitan Statistical Area)",1698878,1944383
40220,"Roanoke, VA (Metropolitan Statistical Area) *",194972,196541
40340,"Rochester, MN (Metropolitan Statistical Area)",139865,147817
40380,"Rochester, NY (Metropolitan Statistical Area)",628582,644221
40420,"Rockford, IL (Metropolitan Statistical Area)",189252,187470
40580,"Rocky Mount, NC (Metropolitan Statistical Area)",77492,74068
40660,"Rome, GA (Metropolitan Statistical Area)",51414,51188
40900,"Sacramento-Roseville-Folsom, CA (Metropolitan Statistical Area)",1191410,1278875
40980,"Saginaw, MI (Metropolitan Statistical Area)",112826,107839
41060,"St. Cloud, MN (Metropolitan Statistical Area)",125143,136291
41100,"St. George, UT (Metropolitan Statistical Area)",67944,85582
41140,"St. Joseph, MO-KS (Metropolitan Statistical Area)",69535,72654
41180,"St. Louis, MO-IL (Metropolitan Statistical Area)",1669564,1733403
41420,"Salem, OR (Metropolitan Statistical Area)",197802,209665
41500,"Salinas, CA (Metropolitan Statistical Area)",221519,244300
41540,"Salisbury, MD-DE (Metropolitan Statistical Area)",197589,210622
41620,"Salt Lake City, UT (Metropolitan Statistical Area)",712951,866902
41660,"San Angelo, TX (Metropolitan Statistical Area)",64073,74367
41700,"San Antonio-New Braunfels, TX (Metropolitan Statistical Area)",1064972,1355935
41740,"San Diego-Chula Vista-Carlsbad, CA (Metropolitan Statistical Area)",1837287,2030064
41860,"San Francisco-Oakland-Berkeley, CA (Metropolitan Statistical Area)",2682602,3183990
41940,"San Jose-Sunnyvale-Santa Clara, CA (Metropolitan Statistical Area)",1120373,1358794
42020,"San Luis Obispo-Paso Robles, CA (Metropolitan Statistical Area)",149346,169362
42100,"Santa Cruz-Watsonville, CA (Metropolitan Statistical Area)",140941,153512
42140,"Santa Fe, NM (Metropolitan Statistical Area)",93143,94402
42200,"Santa Maria-Santa Barbara, CA (Metropolitan Statistical Area)",253193,273782
42220,"Santa Rosa-Petaluma, CA (Metropolitan Statistical Area)",271468,296818
42340,"Savannah, GA (Metropolitan Statistical Area)",190505,223225
42540,"Scranton--Wilkes-Barre, PA (Metropolitan Statistical Area)",308372,321102
42660,"Seattle-Tacoma-Bellevue, WA (Metropolitan Statistical Area)",2099077,2454182
42680,"Sebastian-Vero Beach, FL (Metropolitan Statistical Area)",68831,76236
42700,"Sebring-Avon Park, FL (Metropolitan Statistical Area)",37340,38840
43100,"Sheboygan, WI (Metropolitan Statistical Area)",75062,73412
43300,"Sherman-Denison, TX (Metropolitan Statistical Area)",61002,67231
43340,"Shreveport-Bossier City, LA (Metropolitan Statistical Area)",223295,242690
43420,"Sierra Vista-Douglas, AZ (Metropolitan Statistical Area)",55625,51804
43580,"Sioux City, IA-NE-SD (Metropolitan Statistical Area)",90203,97717
43620,"Sioux Falls, SD (Metropolitan Statistical Area)",160492,194308
43780,"South Bend-Mishawaka, IN-MI (Metropolitan Statistical Area)",174433,171826
43900,"Spartanburg, SC (Metropolitan Statistical Area)",146721,165635
44060,"Spokane-Spokane Valley, WA (Metropolitan Statistical Area)",279167,301590
44100,"Springfield, IL (Metropolitan Statistical Area)",130874,129791
44140,"Springfield, MA (Metropolitan Statistical Area)",369614,399262
44180,"Springfield, MO (Metropolitan Statistical Area)",256341,276349
44220,"Springfield, OH (Metropolitan Statistical Area)",65001,62520
44300,"State College, PA (Metropolitan Statistical Area)",104606,115449
44420,"Staunton, VA (Metropolitan Statistical Area) *",63083,64144
44700,"Stockton, CA (Metropolitan Statistical Area)",283427,310299
44940,"Sumter, SC (Metropolitan Statistical Area)",66575,66230
45060,"Syracuse, NY (Metropolitan Statistical Area)",379598,382342
45220,"Tallahassee, FL (Metropolitan Statistical Area)",212085,219415
45300,"Tampa-St. Petersburg-Clearwater, FL (Metropolitan Statistical Area)",1557459,1664444
45460,"Terre Haute, IN (Metropolitan Statistical Area)",94317,91514
45500,"Texarkana, TX-AR (Metropolitan Statistical Area)",75734,78448
45540,"The Villages, FL (Metropolitan Statistical Area)",24039,40360
45780,"Toledo, OH (Metropolitan Statistical Area)",399734,393312
45820,"Topeka, KS (Metropolitan Statistical Area)",141136,144902
45940,"Trenton-Princeton, NJ (Metropolitan Statistical Area)",259714,276215
46060,"Tucson, AZ (Metropolitan Statistical Area)",473271,500107
