46140,"Tulsa, OK (Metropolitan Statistical Area)",535329,596933
46220,"Tuscaloosa, AL (Metropolitan Statistical Area)",118558,136430
46300,"Twin Falls, ID (Metropolitan Statistical Area)",54863,61285
46340,"Tyler, TX (Metropolitan Statistical Area)",123110,145244
46520,"Urban Honolulu, HI (Metropolitan Statistical Area)",587533,648035
46540,"Utica-Rome, NY (Metropolitan Statistical Area)",157620,154366
46660,"Valdosta, GA (Metropolitan Statistical Area)",70739,75994
46700,"Vallejo, CA (Metropolitan Statistical Area)",179244,187977
47020,"Victoria, TX (Metropolitan Statistical Area)",52340,59881
47220,"Vineland-Bridgeton, NJ (Metropolitan Statistical Area)",77027,74490
47260,"Virginia Beach-Norfolk-Newport News, VA-NC (Metropolitan Statistical Area) *",1027668,1043412
47300,"Visalia, CA (Metropolitan Statistical Area)",177770,200392
47380,"Waco, TX (Metropolitan Statistical Area)",137127,152170
47460,"Walla Walla, WA (Metropolitan Statistical Area)",31930,35118
47580,"Warner Robins, GA (Metropolitan Statistical Area)",81310,92154
47900,"Washington-Arlington-Alexandria, DC-VA-MD-WV (Metropolitan Statistical Area) *",3745027,4198787
47940,"Waterloo-Cedar Falls, IA (Metropolitan Statistical Area)",107311,113757
48060,"Watertown-Fort Drum, NY (Metropolitan Statistical Area)",65950,68755
48140,"Wausau-Weston, WI (Metropolitan Statistical Area)",106902,106052
48260,"Weirton-Steubenville, WV-OH (Metropolitan Statistical Area)",58048,51294
48300,"Wenatchee, WA (Metropolitan Statistical Area)",60974,69016
48540,"Wheeling, WV-OH (Metropolitan Statistical Area)",81069,81498
48620,"Wichita, KS (Metropolitan Statistical Area)",366848,392239
48660,"Wichita Falls, TX (Metropolitan Statistical Area)",85765,88225
48700,"Williamsport, PA (Metropolitan Statistical Area)",67180,70713
48900,"Wilmington, NC (Metropolitan Statistical Area)",144084,166298
49020,"Winchester, VA-WV (Metropolitan Statistical Area) *",72146,79087
49180,"Winston-Salem, NC (Metropolitan Statistical Area)",334166,346871
49340,"Worcester, MA-CT (Metropolitan Statistical Area)",467587,509555
49420,"Yakima, WA (Metropolitan Statistical Area)",114927,128509
49620,"York-Hanover, PA (Metropolitan Statistical Area)",223488,231739
49660,"Youngstown-Warren-Boardman, OH-PA (Metropolitan Statistical Area)",303520,287908
49700,"Yuba City, CA (Metropolitan Statistical Area)",64648,68649
49740,"Yuma, AZ (Metropolitan Statistical Area)",80808,85798